{
  "schema_id": "preflight",
  "schema_version": "1",
  "report_id": "kn3010-20260304T143022Z-a7f3",
  "timestamp": "2026-03-04T14:30:22Z",
  "device": {
    "model": "KN-3010",
    "arch": "mipsel",
    "os_version": "4.1.3",
    "entware": true,
    "storage_type": "usb"
  },
  "capabilities": {
    "commands": {
      "ip": true,
      "ss": true,
      "iptables": true,
      "conntrack": false,
      "wg": true,
      "iwinfo": true,
      "blkid": true,
      "opkg": true
    },
    "files": {
      "/proc/net/dev": true,
      "/opt/etc/init.d": true,
      "/proc/net/nf_conntrack": false
    },
    "endpoints": {
      "rci_local": true,
      "http_rci": false
    }
  },
  "warnings": [
    {
      "code": "LOW_DISK",
      "message_key": "preflight.warn_low_disk",
      "params": {"free_mb": 42}
    }
  ],
  "estimates": {
    "total_time_s": 85,
    "total_size_mb": 12,
    "cpu_peak_pct": 35,
    "ram_peak_mb": 24,
    "io_total_mb": 15
  },
  "collectors_summary": {
    "included": 14,
    "skipped": 4,
    "total": 18
  }
}
